{
  "$schema": "http://json-schema.org/draft-03/schema",
  "required": false,
  "type": "array",
  "items": {
    "required": false,
    "type": "object",
    "properties": {
      "created_at": {
        "required": false,
        "type": "string"
      },
      "id": {
        "required": false,
        "type": "integer"
      },
      "id_str": {
        "required": false,
        "type": "string"
      },
      "name": {
        "required": false,
        "type": "string"
      },
      "position": {
        "required": false,
        "type": "null"
      },
      "query": {
        "required": false,
        "type": "string"
      }
    }
  }
}